{
  "name": "Aleksandr Liukov",
  "jobTitle": "Software Security Engineer",
  "phone": "+375 97 888 176",
  "email": "liukov.aleksandr91@gmail.com",
  "linkedinUrl": "https://www.linkedin.com/in/aleksandr-liukov/?locale=en_US",
  "profile": "Security engineer with 11 years of experience bridging infrastructure operations and security engineering. Core expertise in Kubernetes cluster hardening, CI/CD pipeline security, and Infrastructure as Code automation. Develops security tooling in Python and builds controls directly into development workflows—enabling engineering velocity while maintaining security posture. CISSP and OSCP certified. Currently exploring AI-assisted security operations, developing tools that leverage LLMs for vulnerability triage and code analysis. Advocate for practical, non-blocking security that scales.",
  "workRights": "Based in Cyprus. Open to relocation. Requires visa sponsorship.",
  "sectionLabels": {
    "profile": "Profile",
    "workRights": "Work Rights",
    "coreSkills": "Core Skills &\nTechnologies",
    "employment": "Employment History",
    "education": "Education",
    "certifications": "Certifications"
  },
  "skills": [
    {
      "title": "Cloud & Container Security",
      "description": "Kubernetes (Kyverno, Falco, Seccomp, kubebench), Docker, AWS, Azure, IAM, network segmentation, encryption controls"
    },
    {
      "title": "DevSecOps & Automation",
      "description": "Python, Ansible, Terraform, CI/CD pipeline security, SAST/SCA integration, GitOps, Infrastructure as Code"
    },
    {
      "title": "Security Architecture",
      "description": "Threat modeling (STRIDE), risk assessment, zero-trust, defense-in-depth, secure design reviews, MITRE ATT&CK"
    },
    {
      "title": "Security Operations",
      "description": "SIEM (Splunk, Humio/CrowdStrike), vulnerability management (DefectDojo, Qualys), log analytics, incident response"
    }
  ],
  "employment": [
    {
      "dates": "Aug 2024 — Present",
      "title": "Lead Product Security Engineer",
      "company": "Unlimit",
      "location": "Cyprus",
      "duties": [
        "Architect and deploy enterprise-wide security pipeline integrating SAST, SCA, and secrets scanning into CI/CD with automated findings ingestion and developer-facing dashboards",
        "Engineer integrated vulnerability management system (DefectDojo + Python automation + Jira) consolidating security findings from multiple scanners and automating remediation workflows",
        "Develop AI-driven tools leveraging LLMs to examine codebases for business logic vulnerabilities and automate triage of scanner findings",
        "Conduct internal penetration testing of web applications, APIs, and infrastructure; identified critical vulnerabilities in company products and vendor banking software",
        "Perform security design reviews and provide security expertise to product teams throughout the SDLC"
      ]
    },
    {
      "dates": "Apr 2023 — Aug 2024",
      "title": "Information Security Architect",
      "company": "Kaspersky Lab",
      "location": "Russia",
      "duties": [
        "Define and document secure architecture principles for products and infrastructure",
        "Evaluate product and system designs to identify security flaws and recommend remediation strategies",
        "Develop and implement Secure Software Development Lifecycle (SSDLC) processes across engineering teams",
        "Conduct targeted penetration testing of applications and services, identifying critical vulnerabilities in company software products"
      ]
    },
    {
      "dates": "Sep 2021 — Apr 2023",
      "title": "Senior Cyber Security Engineer",
      "company": "TheSoul Publishing",
      "location": "Cyprus",
      "duties": [
        "Strengthen security of Kubernetes clusters through policy enforcement (Kyverno, Falco) and runtime protection controls",
        "Harden CI/CD pipelines with security scanning integration, dependency verification, and automated policy checks",
        "Automate and maintain security controls including SAST, DAST, and IaC-based deployments using Terraform and Ansible",
        "Develop secure remote access solution for corporate infrastructure with automated access controls, routing, and monitoring",
        "Manage SIEM, IDS, and vulnerability scanners with focus on alert optimization and actionable security insights"
      ]
    },
    {
      "dates": "Jan 2020 — Sep 2021",
      "title": "Information Security Engineer",
      "company": "Vkontakte",
      "location": "Russia",
      "duties": [
        "Develop and maintain security automation scripts (Python) to streamline operations and enforce security controls at scale",
        "Configure SIEM platforms (Splunk, Humio) and log processing pipelines (Logstash) for enterprise monitoring",
        "Design complex correlation queries transforming raw log data into actionable security alerts",
        "Deploy log collection agents (winlogbeat, sysmon, osquery) across corporate infrastructure and initiate mass deployment"
      ]
    },
    {
      "dates": "Aug 2018 — Jan 2020",
      "title": "System Integration Specialist",
      "company": "Positive Technologies",
      "location": "Russia",
      "duties": [
        "Deploy and configure security products across customer environments including OS hardening and network encryption appliances",
        "Create automation scripts (Python, Bash) for repeatable installation and integration of security solutions",
        "Develop automated attack simulations to test and validate detection capabilities during integration projects"
      ]
    },
    {
      "dates": "Nov 2017 — Jul 2018",
      "title": "Security Engineer",
      "company": "GDC (Fujitsu)",
      "location": "Russia",
      "duties": [
        "Administer MFA solution and manage user-issued token lifecycle",
        "Investigate security alerts and assess change requests from security perspective"
      ]
    },
    {
      "dates": "Oct 2016 — Nov 2017",
      "title": "IT Engineer",
      "company": "GDC (Fujitsu)",
      "location": "Russia",
      "duties": [
        "Administer enterprise identity infrastructure (Active Directory, MFA, Microsoft Identity Manager) and manage access control lifecycle",
        "Manage Microsoft Azure environment and Active Directory Domain Services with PowerShell automation"
      ]
    },
    {
      "dates": "Jan 2016 — Oct 2016",
      "title": "System Administrator",
      "company": "Atos IT Solutions & Services",
      "location": "Russia",
      "duties": [
        "Maintain enterprise Windows Server infrastructure, VMware, and IBM WebSphere with automated patch management (SCCM, WSUS)"
      ]
    }
  ],
  "education": [
    {
      "year": "2014",
      "institution": "Voronezh State Technical University",
      "location": "Russia",
      "degree": "Computer Systems & Networks: Bachelor's Degree (5-year Specialist program)"
    }
  ],
  "certifications": [
    {
      "date": "2022",
      "name": "CISSP (Certified Information Systems Security Professional) — (ISC)²"
    },
    {
      "date": "2020",
      "name": "OSCP (Offensive Security Certified Professional) — Offensive Security"
    },
    {
      "date": "2017",
      "name": "MCSE: Cloud Platform and Infrastructure — Microsoft"
    },
    {
      "date": "2018",
      "name": "Splunk Certified User — Splunk"
    }
  ]
}
