{
  "name": "Aleksandr Liukov",
  "jobTitle": "Staff Product Security Engineer",
  "phone": "+375 97 888 176",
  "email": "liukov.aleksandr91@gmail.com",
  "linkedinUrl": "https://www.linkedin.com/in/aleksandr-liukov/?locale=en_US",
  "profile": "Security engineer with 11 years of experience specializing in product security and secure SDLC. Architects enterprise security pipelines integrating SAST, SCA, and DAST into CI/CD workflows, enabling engineering teams to ship secure code faster. Conducts security design reviews, threat modeling, and penetration testing with risk-based prioritization. OSCP certified with hands-on exploit development experience. Strong Python automation skills for scalable security operations.",
  "workRights": "Based in Cyprus. Open to relocation. Require employer-sponsored visa.",
  "sectionLabels": {
    "profile": "Profile",
    "workRights": "Work Rights",
    "coreSkills": "Core Skills &\nTechnologies",
    "employment": "Employment History",
    "education": "Education",
    "certifications": "Certifications"
  },
  "skills": [
    {
      "title": "Application Security & SDLC",
      "description": "Secure SDLC, SAST, SCA, DAST, OWASP ASVS, Burp Suite, OWASP ZAP, WAF, threat modeling, design reviews, code review"
    },
    {
      "title": "Security Architecture & Design",
      "description": "Defense-in-depth, zero-trust principles, STRIDE, MITRE ATT&CK, risk assessment, security requirements"
    },
    {
      "title": "Vulnerability Management",
      "description": "DefectDojo, identification, triage, remediation workflows, false-positive reduction, Qualys, Nessus"
    },
    {
      "title": "Programming & Automation",
      "description": "Python (advanced), Bash (advanced), PowerShell, security tooling development, exploit scripting"
    },
    {
      "title": "Cloud & Container Security",
      "description": "AWS, Kubernetes, Docker, Kyverno, Falco, Seccomp, CI/CD pipeline security, Terraform, Ansible"
    },
    {
      "title": "Security Operations",
      "description": "SIEM (Splunk, Humio/CrowdStrike), incident response support, log analysis, alert correlation, security monitoring"
    }
  ],
  "employment": [
    {
      "dates": "Aug 2024 — Present",
      "title": "Lead Product Security Engineer",
      "company": "Unlimit",
      "location": "Cyprus",
      "duties": [
        "Architect and deploy enterprise-wide security pipeline integrating SAST, SCA, and secrets scanning into CI/CD workflows with automated findings ingestion for developer-actionable remediation",
        "Engineer integrated vulnerability management system (DefectDojo + Python automation) consolidating findings from multiple scanners with automated triage and false-positive reduction",
        "Perform security design reviews and threat modeling for product features across engineering teams throughout the SDLC",
        "Conduct application penetration testing of web applications and APIs, identifying vulnerabilities and validating exploitability",
        "Develop AI-assisted tooling for automated codebase security analysis and business logic vulnerability detection",
        "Define and enforce application security requirements as security SME for in-house software products"
      ]
    },
    {
      "dates": "Apr 2023 — Aug 2024",
      "title": "Information Security Architect",
      "company": "Kaspersky Lab",
      "location": "Russia",
      "duties": [
        "Defined and documented secure architecture principles for products and infrastructure, establishing security standards",
        "Evaluated product and system designs to identify security flaws and recommended risk-based remediation strategies",
        "Advised engineering teams on mitigating risks and embedding security controls into design decisions",
        "Conducted targeted penetration testing of applications and services to validate security posture"
      ]
    },
    {
      "dates": "Sep 2021 — Apr 2023",
      "title": "Senior Cyber Security Engineer",
      "company": "TheSoul Publishing",
      "location": "Cyprus",
      "duties": [
        "Automated and maintained security controls including SAST, DAST, and Infrastructure as Code deployments",
        "Strengthened security of Kubernetes clusters and CI/CD pipelines with policy enforcement and container security controls",
        "Managed SIEM, IDS, and vulnerability scanners with focus on alert optimization and actionable security monitoring"
      ]
    },
    {
      "dates": "Jan 2020 — Sep 2021",
      "title": "Information Security Engineer",
      "company": "Vkontakte",
      "location": "Russia",
      "duties": [
        "Developed and maintained internal security automation tools (Python) to streamline security operations and enforce controls",
        "Managed SIEM platform (Splunk), configured log collection infrastructure (sysmon, osquery), and developed correlation queries for threat detection",
        "Investigated security alerts through log analysis, identifying threats and tuning detection rules for false-positive reduction"
      ]
    },
    {
      "dates": "Aug 2018 — Jan 2020",
      "title": "System Integration Specialist",
      "company": "Positive Technologies",
      "location": "Russia",
      "duties": [
        "Developed automated attack simulations and exploit scripts to validate detection capabilities of security products",
        "Created automation frameworks (Python, Bash) for repeatable deployment and integration of security solutions"
      ]
    },
    {
      "dates": "Oct 2016 — Aug 2018",
      "title": "IT Engineer",
      "company": "GDC (Fujitsu)",
      "location": "Russia",
      "duties": [
        "Administered enterprise identity infrastructure (Active Directory, MFA) and managed access control lifecycle",
        "Investigated security alerts using Splunk and endpoint protection systems"
      ]
    },
    {
      "dates": "Jun 2014 — Oct 2016",
      "title": "System Administrator",
      "company": "Atos IT Solutions & Services",
      "location": "Russia",
      "duties": [
        "Maintained enterprise Windows Server and VMware infrastructure with PowerShell automation"
      ]
    }
  ],
  "education": [
    {
      "year": "2014",
      "institution": "Voronezh State Technical University",
      "location": "Russia",
      "degree": "Computer Systems & Networks: Bachelor's Degree (5-year Specialist program)"
    }
  ],
  "certifications": [
    {
      "date": "2022",
      "name": "CISSP (Certified Information Systems Security Professional) — (ISC)²"
    },
    {
      "date": "2020",
      "name": "OSCP (Offensive Security Certified Professional) — Offensive Security"
    }
  ]
}
