{
  "name": "Aleksandr Liukov",
  "jobTitle": "Software Security Engineer",
  "phone": "+357 97 888 176",
  "email": "liukov.aleksandr91@gmail.com",
  "linkedinUrl": "https://www.linkedin.com/in/aleksandr-liukov/?locale=en_US",
  "profile": "Security engineer with 11 years of experience rooted in IT infrastructure, DevSecOps, and platform security. Specializes in securing containerized environments through Kubernetes security controls, policy enforcement, and Infrastructure-as-Code automation. Strong advocate for secure-by-design workflows and CI/CD pipeline security. Builds security tooling in Python, with recent focus on AI-driven code analysis. CISSP and OSCP certified.",
  "workRights": "Based in Cyprus. Open to relocation to London. Require employer-sponsored visa.",
  "sectionLabels": {
    "profile": "Profile",
    "workRights": "Work Rights",
    "coreSkills": "Core Skills &\nTechnologies",
    "employment": "Employment History",
    "education": "Education",
    "certifications": "Certifications"
  },
  "skills": [
    {
      "title": "Cloud & Platform Security",
      "description": "AWS, Microsoft Azure, multi-cloud architecture, IAM, network segmentation, encryption controls, cloud security posture"
    },
    {
      "title": "Container Security",
      "description": "Kubernetes, Docker, Kyverno, Falco, Seccomp, kubebench, container orchestration, security policy enforcement"
    },
    {
      "title": "DevSecOps & CI/CD Security",
      "description": "Pipeline security, SAST, SCA, secrets scanning, GitOps workflows, secure SDLC, supply chain security"
    },
    {
      "title": "Infrastructure as Code",
      "description": "Terraform, Ansible, automated configuration management, policy enforcement, infrastructure automation"
    },
    {
      "title": "Security Architecture",
      "description": "Threat modeling, STRIDE, MITRE ATT&CK, defense-in-depth, zero-trust principles, risk assessment"
    },
    {
      "title": "Identity & Access Management",
      "description": "Active Directory, MFA, Microsoft Identity Manager, access control lifecycle, enterprise identity infrastructure"
    },
    {
      "title": "Automation & Development",
      "description": "Python (advanced), Bash, PowerShell, Go, AI-assisted code analysis (Claude Code), security tooling development"
    },
    {
      "title": "Security Operations",
      "description": "Splunk, Humio/CrowdStrike, log analytics, alert correlation, DefectDojo, vulnerability management"
    }
  ],
  "employment": [
    {
      "dates": "Aug 2024 — Present",
      "title": "Lead Product Security Engineer",
      "company": "Unlimit",
      "location": "Cyprus",
      "duties": [
        "Architect and deploy enterprise-wide security pipeline integrating SAST, SCA, and secrets scanning into CI/CD with automated findings ingestion and developer dashboards",
        "Engineer integrated vulnerability management system (DefectDojo + Python automation + Jira) consolidating findings from multiple scanners and automating remediation lifecycle",
        "Develop AI-driven tools to examine codebases for business logic vulnerabilities and automate triage of security scanner findings",
        "Perform security design reviews of software products and infrastructure architecture, advising engineering teams on risk mitigation",
        "Administer corporate HSM instances (hardware and cloud-based) including cryptographic key migration from on-premises to cloud environment"
      ]
    },
    {
      "dates": "Apr 2023 — Aug 2024",
      "title": "Information Security Architect",
      "company": "Kaspersky Lab",
      "location": "Russia",
      "duties": [
        "Define and document secure architecture principles for products and infrastructure, establishing security-by-design standards",
        "Evaluate product and system designs to identify security flaws and recommend remediation strategies",
        "Develop and implement Secure Software Development Lifecycle (SSDLC) processes across engineering teams",
        "Advise and guide engineering teams on mitigating risks and embedding security controls into architecture decisions",
        "Conduct targeted penetration testing of applications and services to validate security posture"
      ]
    },
    {
      "dates": "Sep 2021 — Apr 2023",
      "title": "Senior Cyber Security Engineer",
      "company": "TheSoul Publishing",
      "location": "Cyprus",
      "duties": [
        "Strengthen security of Kubernetes clusters and CI/CD pipelines, implementing container security policies and runtime protection",
        "Automate and maintain security controls through Infrastructure as Code: SAST, DAST deployments using Terraform and Ansible",
        "Develop secure remote access solution for corporate infrastructure with automated access controls, routing, and monitoring",
        "Manage SIEM platform, IDS, and vulnerability scanners with focus on alert optimization and actionable security intelligence",
        "Deploy container security tooling including Kyverno for policy enforcement and Falco for runtime threat detection"
      ]
    },
    {
      "dates": "Jan 2020 — Sep 2021",
      "title": "Information Security Engineer",
      "company": "Vkontakte",
      "location": "Russia",
      "duties": [
        "Develop and maintain internal security tools and automation scripts (Python) to streamline operations and enforce controls at scale",
        "Manage SIEM platforms (Splunk, Humio) and configure log processing pipelines (Logstash) for enterprise monitoring",
        "Prepare and deploy log collection agents (winlogbeat, sysmon, osquery) across corporate infrastructure",
        "Develop complex correlation queries transforming high-volume raw log data into actionable security alerts"
      ]
    },
    {
      "dates": "Aug 2018 — Jan 2020",
      "title": "System Integration Specialist",
      "company": "Positive Technologies",
      "location": "Russia",
      "duties": [
        "Deploy and configure security products across customer environments including OS hardening and network encryption appliances",
        "Create automation scripts (Python, Bash) for repeatable installation, configuration, and integration of security solutions",
        "Develop automated attack simulations to test and validate detection capabilities during integration projects"
      ]
    },
    {
      "dates": "Nov 2016 — Jul 2018",
      "title": "Security Engineer / IT Engineer",
      "company": "GDC (Fujitsu preferred supplier)",
      "location": "Russia",
      "duties": [
        "Administer enterprise identity infrastructure (Active Directory, MFA, Microsoft Identity Manager) and manage access control lifecycle",
        "Investigate security alerts using Splunk and endpoint protection systems, assess change requests for security impact"
      ]
    },
    {
      "dates": "Jan 2015 — Oct 2016",
      "title": "System Administrator",
      "company": "Atos IT Solutions & Services",
      "location": "Russia",
      "duties": [
        "Maintain enterprise Windows Server infrastructure, VMware vCenter, and IBM WebSphere with system monitoring and patching",
        "Automate identity management workflows and maintenance tasks using PowerShell"
      ]
    }
  ],
  "education": [
    {
      "year": "2014",
      "institution": "Voronezh State Technical University",
      "location": "Russia",
      "degree": "Computer Systems & Networks: Bachelor's Degree (5-year Specialist program)"
    }
  ],
  "certifications": [
    {
      "date": "2022",
      "name": "CISSP (Certified Information Systems Security Professional) — (ISC)²"
    },
    {
      "date": "2020",
      "name": "OSCP (Offensive Security Certified Professional) — Offensive Security"
    },
    {
      "date": "2017",
      "name": "MCSE: Cloud Platform and Infrastructure — Microsoft"
    },
    {
      "date": "2018",
      "name": "Splunk Certified User — Splunk"
    }
  ]
}
